{
 "artist": {
  "artist_id": "ARTIST-01",
  "name": "Studio Lin (synthetic)",
  "royalty_rate_bp": 800
 },
 "certificate": {
  "hash_algorithm": "sha256",
  "prefix": "CERT-ED",
  "template_ref": "docs/data-contracts.md#collector-record"
 },
 "concept_id": "DC-0001",
 "created_at": "2026-10-23T00:15:00Z",
 "edition_id": "ED-0001",
 "manufacturer": {
  "name": "Harbour jewelry works A",
  "workshop_id": "WS-JW-A"
 },
 "numbering": {
  "issued": [
   {
    "certificate_id": "CERT-ED-0001-0001",
    "collector_id": "COL-0001",
    "issued_at": "2026-10-23T00:15:00Z",
    "number": 1,
    "order_id": "ORD-9999"
   }
  ],
  "policy": "sequential",
  "reserved": []
 },
 "size": 8,
 "status": "open",
 "title": {
  "en": "Sea mist interlace ring",
  "zh": "海雾缠枝戒"
 }
}
